{
  "$schema": "https://json-schema.org/draft/2020-12/schema",
  "$id": "https://schemas.ratemyrepresentatives.com/v1/api-error.schema.json",
  "title": "ApiError",
  "description": "Privacy-safe v1 API error envelope that prevents account and authority enumeration.",
  "type": "object",
  "additionalProperties": false,
  "required": [
    "schemaVersion",
    "code",
    "message",
    "correlationId",
    "fieldErrors",
    "retryable",
    "retryAfterSeconds",
    "featureState",
    "dependencyState"
  ],
  "properties": {
    "schemaVersion": { "const": "api-error.v1" },
    "code": {
      "enum": [
        "NOT_FOUND",
        "METHOD_NOT_ALLOWED",
        "FEATURE_DISABLED",
        "VALIDATION_ERROR",
        "CONFLICT",
        "PRECONDITION_FAILED",
        "RATE_LIMITED",
        "DEPENDENCY_UNAVAILABLE",
        "MAINTENANCE",
        "UNAUTHENTICATED",
        "FORBIDDEN",
        "GONE"
      ]
    },
    "message": { "type": "string", "minLength": 1, "maxLength": 256 },
    "correlationId": {
      "type": "string",
      "pattern": "^[a-zA-Z0-9][a-zA-Z0-9._:-]{0,127}$"
    },
    "fieldErrors": {
      "type": "array",
      "maxItems": 32,
      "items": {
        "type": "object",
        "additionalProperties": false,
        "required": ["field", "code"],
        "properties": {
          "field": { "type": "string", "pattern": "^[a-zA-Z0-9][a-zA-Z0-9._\\[\\]-]{0,127}$" },
          "code": { "type": "string", "pattern": "^[A-Z][A-Z0-9_]{0,63}$" }
        }
      }
    },
    "retryable": { "type": "boolean" },
    "retryAfterSeconds": { "type": ["integer", "null"], "minimum": 0 },
    "featureState": { "enum": ["operational", "testnet", "proposed", "disabled", null] },
    "dependencyState": { "enum": ["ready", "degraded", "unavailable", "disabled", null] }
  }
}
